{
  "schema_version": "1.0",
  "app_id": "interview",
  "display_name": "iweioo Interview",
  "status": "planned",
  "public_base_url": "https://interview.iweioo.com",
  "oidc": {
    "audience": "iweioo-interview",
    "redirect_uris": ["https://interview.iweioo.com/auth/callback"],
    "post_logout_redirect_uris": ["https://interview.iweioo.com/"]
  },
  "billing": {
    "billable": true,
    "authority": "iweioo-platform-api",
    "service_scopes": ["usage:write", "events:write"]
  },
  "privacy": {
    "owned_data_classes": ["answer", "interview-session", "report", "training-history"],
    "lifecycle_callback_path": "/internal/v1/privacy/jobs"
  },
  "observability": {
    "health_path": "/health/live",
    "readiness_path": "/health/ready",
    "metrics_path": "/metrics"
  }
}
